Date,Text,likes,retweets,replys,polarity_textblob,sentiment_textblob,polarity_nltk,sentiment_nltk
2021-01-28,"u cant sell houses u dont own
u cant sell cars u dont own
but 
u can sell stock u dont own!?
this is bs  shorting is a scam
legal only for vestigial reasons",708113,129685,20606,0.43,positive,-0.68,negative
2021-01-28, finishing engineering this year production starts next year. aiming to have release candidate design drivable late summer. trimotor drive system  advanced battery work were important precursors.,6583,289,317,0.125,positive,0.4215,positive
2021-01-28,  i made that video!,4922,104,193,0.0,neutral,0.0,neutral
2021-01-28, unlike its aircraft division which is fine the faa space division has a fundamentally broken regulatory structure.  their rules are meant for a handful of expendable launches per year from a few government facilities. under those rules humanity will never get to mars.,20340,2251,1274,-0.061111111111111116,negative,-0.3182,negative
2021-01-28,the esthetics of cyberpunk are incredible btw. the interior design is.,108840,2290,2037,0.9,positive,0.0,neutral
2021-01-28,  major esthetics improvements coming,6584,184,347,0.0625,positive,0.3182,positive
2021-01-28, new roadster is part rocket,4684,269,153,0.13636363636363635,positive,0.0,neutral
2021-01-28,   theres more storage now  easily upgradable,2564,84,107,0.4666666666666667,positive,0.3947,positive
2021-01-28,  yeah probably in a few months,1753,51,71,-0.2,negative,0.296,positive
2021-01-28, after you drive without using a prnd stalkstick for a few days it gets very annoying to go back  use a shifter!,2464,165,215,-0.39999999999999997,negative,-0.5081,negative
2021-01-28, no more stalks. car guesses drive direction based on what obstacles it sees context  nav map. you can override on touchscreen.,10229,582,514,-0.15,negative,-0.5859,negative
2021-01-28, a hedge fund that shorts is a shrubbery,61511,3734,1223,0.0,neutral,0.0,neutral
2021-01-28,  yeah also a rear screen,2146,73,137,0.0,neutral,0.296,positive
2021-01-28,0 to 155mph trap speed in a 14 mile. 200mph top speed with right tires.,75494,2117,1578,0.39285714285714285,positive,-0.128,negative
2021-01-28,first production car ever to achieve 0 to 60 mph in less than 2 seconds,127384,5298,2297,0.04166666666666667,positive,0.0,neutral
2021-01-28,it can play cyberpunk,204777,8039,4369,0.0,neutral,0.34,positive
2021-01-28,plaid model s ships next month ,459740,32263,13983,0.0,neutral,0.0,neutral
2021-01-28,even discord has gone corpo ,545836,39290,13699,0.0,neutral,-0.4019,negative
2021-01-26, yup. wild times on discord haha.,32516,1275,811,0.15000000000000002,positive,0.0772,positive
2021-01-26, waiting for faa review ,6517,184,227,0.0,neutral,0.0,neutral
2021-01-26, passed initial pressure test,7880,248,219,0.0,neutral,-0.296,negative
2021-01-26,bought a hand knit wool marvin the martian helm for my dog,128009,2491,2661,0.0,neutral,0.4939,positive
2021-01-26,i kinda love etsy,310198,16566,12787,0.5,positive,0.6003,positive
2021-01-26, it does not serve the public to hamstring starlink today for an amazon satellite system that is at best several years away from operation,4442,330,225,0.3333333333333333,positive,0.7096,positive
2021-01-26, were hoping for faa approval of a test flight tomorrow afternoon,11440,578,390,0.0,neutral,0.7096,positive
2021-01-25, the entire stack from data collection through labeling  inference has to be in surround video. this is a hard problem. critically however this does not require a hardware change to cars in field.,2615,153,176,-0.09722222222222222,negative,-0.4767,negative
2021-01-25,  yes although it will be crazy not to turn  on fsd,2538,75,141,-0.6,negative,0.0772,positive
2021-01-25, tesla is steadily moving all nns to 8 camera surround video. this will enable superhuman selfdriving.,3517,330,149,0.16666666666666666,positive,0.0,neutral
2021-01-25, some tyranny. also the road to hell is mostly paved with bad intentions.,7797,356,306,-0.09999999999999992,negative,-0.8442,negative
2021-01-25,    all sats launched next year will have laser links. only our polar sats have lasers this year  are v0.9.,2302,155,102,-0.027777777777777776,negative,0.128,positive
2021-01-25, these also have laser links between the satellites so no ground stations are needed over the poles,11176,488,360,0.0,neutral,-0.4341,negative
2021-01-25,  sorry for the version confusion. v8.1 is what it should say for fsd. separate version number for rest of car.,1009,49,69,-0.5,negative,-0.296,negative
2021-01-25, to my surprise tesla has better ai hardware  software than waymo money,21320,911,630,0.5,positive,0.6124,positive
2021-01-24,  falloutthemed opening party for vegas loop happening as soon as allowed!,10911,422,451,0.0,neutral,0.4574,positive
2021-01-24,under vegas in  tunnel yesterday with my boys ,199176,8807,4963,0.0,neutral,0.0,neutral
2021-01-23, were switching to a more sensible fsd version numbering to distinguish between major  minor updates. current build is fsd 8.1. it drove me to an unfamiliar location in la  back last night with no interventions!,4854,273,315,0.08541666666666665,positive,-0.3595,negative
2021-01-23, hopefully early next week,5663,299,227,0.05,positive,0.4019,positive
2021-01-23,  given so many other companies are depending on this mission it is getting even more scrutiny than a starlink flight,14155,383,344,0.2916666666666667,positive,0.0,neutral
2021-01-22,launching many small satellites for a wide range of customers tomorrow. excited about offering lowcost access to orbit for small companies! ,73598,5078,3221,0.0425,positive,0.4003,positive
2021-01-22, they are part of the solution but require lots of fresh water  land. we may need something thats ultralarge scale industrial in 10 to 20 years. for now by far the top priority is accelerating the transition to a sustainable energy economy.,16062,723,1403,0.3,positive,0.8151,positive
2021-01-22, its a good path for fully renewable rocket energy so solves part of problem but longer chain hydrocarbons than ch4 are needed to be solid at room temp,16758,479,566,0.35,positive,0.5503,positive
2021-01-21,am donating 100m towards a prize for best carbon capture technology,576281,53480,55027,1.0,positive,0.8176,positive
2021-01-21,      that would probably mean civilization is doing great although depends on assumptions for inflation haha,24820,568,712,0.22916666666666666,positive,0.7964,positive
2021-01-18, the ratelimiting part or process in cell production is constantly changing,3623,123,272,0.0,neutral,0.0,neutral
2021-01-18,  cars  trucks stuck in traffic generate megatons of toxic gases  particulate but  road tunnels under miami would solve traffic  be an exle to the world.  spoke with  about tunnels last week. if governor  mayor want this done we will do it.,11276,1158,1585,0.0,neutral,0.2846,positive
2021-01-18,   with our giant casting machines we are literally trying to make fullsize cars in the same way that toy cars are made,6845,508,354,0.0,neutral,0.0,neutral
2021-01-18,  tegmark is an exceptionally smart  good human,8125,219,206,0.30476190476190473,positive,0.7328,positive
2021-01-18, the best manufacturing technology is in ultra high volume industries like food  beverage some medical eg syringes  toys,5179,236,216,0.38666666666666666,positive,0.7717,positive
2021-01-18,battery cell production is the fundamental ratelimiter slowing down a sustainable energy future. very important problem. ,136893,10421,6096,0.12148148148148148,positive,0.0553,positive
2021-01-18, looking into this. no question that fsd should be viewed as reasonably valuable when doing a tradein.,6449,273,643,0.2,positive,0.1531,positive
2021-01-17, this is a good one,14077,234,454,0.7,positive,0.4404,positive
2021-01-16,   cybertruck doesnt need a garage,7220,378,617,0.0,neutral,0.0,neutral
2021-01-16,  it will be awesome,33010,625,921,1.0,positive,0.6249,positive
2021-01-16, your serverside code is doing too much,7516,297,321,0.2,positive,0.0,neutral
2021-01-15, happy birthday wikipedia! so glad you exist.,42050,1547,740,0.75,positive,0.8342,positive
2021-01-15, guess you been watching cobra kai,30353,783,622,0.0,neutral,0.0,neutral
2021-01-15,  only chuck norris can divide by zero,7182,436,312,0.0,neutral,0.0,neutral
2021-01-15,  the thing we call money is just an information system for labor allocation.  what actually matters is making goods  providing services.  we should look at currencies from an information theory standpoint.  whichever has least error  latency will win.,14329,2828,1284,0.16666666666666666,positive,0.7317,positive
2021-01-15,"monty python is amazing
",99311,6686,5912,0.6000000000000001,positive,0.5859,positive
2021-01-15,   they sure can twist the knife in that show!,1668,40,85,0.625,positive,0.3802,positive
2021-01-15, were making major improvements to ease of engine swap. needs to be a few hours at most.,8783,234,259,0.12083333333333333,positive,0.5859,positive
2021-01-15,   two of the engines need slight repairs so will be switched out,3744,170,161,-0.16666666666666666,negative,0.0,neutral
2021-01-15, we dont have high school internships but please apply when youre in college!,2960,80,128,0.2,positive,0.501,positive
2021-01-14, prototypes are easy volume production is hard positive cash flow is  excruciating,5857,505,316,0.12297979797979797,positive,0.2023,positive
2021-01-13, detanking  inspections now. good progress towards our hop in  go to mars! goal.,12008,490,386,0.875,positive,0.7177,positive
2021-01-13,all three static fires completed  no ruds!,62506,1648,1413,0.625,positive,-0.3595,negative
2021-01-13,   wow a lot has happened in 10 years!,3198,88,104,0.125,positive,0.6239,positive
2021-01-13, sea shanty tiktok takes it to a new level with actual pirate ships,4109,126,161,0.06818181818181818,positive,0.0,neutral
2021-01-13,today at spacex is about practicing starship engine starts. ship is held down by massive pins while engines are fired. two starts completed about to try a third.,157478,6485,4029,-0.051851851851851864,negative,-0.5574,negative
2021-01-13, you can steal our namelogos  we probably wont sue you,39860,1498,1016,0.0,neutral,-0.4939,negative
2021-01-13,  were just trying to get people to mars. help would be appreciated.,6664,375,424,0.2,positive,0.7184,positive
2021-01-13,  one day we will get a camera up there that also shows the star field in the background,37208,1169,1121,0.0,neutral,0.0,neutral
2021-01-13, suicide is more than double homicide ,5029,366,292,0.25,positive,-0.6705,negative
2021-01-12,"hey you 
yeah you queen 
youre gonna make it!  ",557090,103595,12187,0.0,neutral,0.3595,positive
2021-01-12,   hate to say it but might be true,2214,75,166,-0.22500000000000003,negative,0.3291,positive
2021-01-12, the robot future is coming,36463,1800,1478,0.0,neutral,0.0,neutral
2021-01-12,  300km every millisecond but there are times i wish it were faster,9663,364,464,0.0,neutral,0.5499,positive
2021-01-12,  this is an important distinction,8989,571,309,0.4,positive,0.2023,positive
2021-01-11, much more than this  increasing rapidly,12706,569,462,0.5,positive,0.0,neutral
2021-01-11, once in a while something happens that is even better than we imagined,47944,5144,1109,0.5,positive,0.4404,positive
2021-01-11, the factory is the product,6468,504,355,0.0,neutral,0.0,neutral
2021-01-11,  probably commenting on  will do more,5821,355,267,0.5,positive,0.0,neutral
2021-01-11, i bought the replacement glass from a junkyard for 20. theyre great places to get spare parts.,125880,3469,2383,0.8,positive,0.6249,positive
2021-01-11, a lot of people are going to be super unhappy with west coast high tech as the de facto arbiter of free speech,83425,18893,3566,0.07333333333333333,positive,0.6597,positive
2021-01-11,  already donated to signal a year ago. will donate more.,6250,462,232,0.5,positive,0.0,neutral
2021-01-10, i am primarily trying to advance two causes sustainable energy  extending lifeconsciousness beyond earth. there is also the existential threat of ai which we should aspire to mitigate. this doesnt leave time to write books.,14548,1538,810,0.4,positive,-0.2851,negative
2021-01-09,  maybe a tesla ai day later this year,4986,380,255,0.0,neutral,0.0,neutral
2021-01-09,  yes but not for long,2342,65,88,-0.05,negative,0.2144,positive
2021-01-09, yeah they seemed optimistic too,848,21,37,0.0,neutral,0.5423,positive
2021-01-09,my 14yearold son saxon said he feels like 2021 will be a good year. i agree. let us all make it so.,888306,61395,27671,0.7,positive,0.7845,positive
2021-01-09,  was also thinking that spacex boca should hold fun parties and give tours for the community from time to time,9304,272,375,0.3,positive,0.7184,positive
2021-01-09,  i super support public spaces around our production  launch sites wherever it can be done safely and securely. when covid passes we will open up our restaurant to the public  figure out ways to allow limited access to the high bar.,9344,393,272,0.16523809523809524,positive,0.9042,positive
2021-01-09,   catapult high into the air  land on the roof with a base jumping parachute the only way to travel,17976,759,1978,-0.21333333333333335,negative,0.0,neutral
2021-01-09,  thats actually our restaurant but spacex is building a futuristic bar at the top of the high bay with 360 degree windows  a glass floor looking down on the rocket factory,18110,719,562,0.12611111111111112,positive,0.296,positive
2021-01-09, and increase fun! hopefully.,2268,82,140,0.375,positive,0.8221,positive
2021-01-09,  one of the best tesla solar roof installations,2657,95,117,1.0,positive,0.6369,positive
2021-01-09, no but maybe one day,3689,422,354,0.0,neutral,-0.1531,negative
2021-01-09,  yes that would be the best way to do it. a large solar field or reactor is needed for power and then some ice mining droids or long maneuvering drills are needed for the h2o. these are probably the trickier bits.,2588,122,148,0.38809523809523805,positive,0.7351,positive
2021-01-08, probably less than a few dozen primary decisionmakers. technically only three.,59965,3602,1469,0.008333333333333331,positive,0.0,neutral
2021-01-08,  or at least the option for verification so that the public can ascribe more credibility to verified vs unverified accounts,9460,325,599,0.06666666666666667,positive,0.0,neutral
2021-01-08,btw critical feedback is always super appreciated as well as ways to donate money that really make a difference way harder than it seems,234318,10165,26744,0.12666666666666668,positive,0.7906,positive
2021-01-07, indirectly an electric rocket is possible by using electricity to convert co2h2o gt ch4o2. this will be needed on mars even for early missions  earth too over time.,12038,643,317,0.05,positive,0.2732,positive
2021-01-07, not to get to orbit unfortunately. in space photon emission powered by matterantimatter annihilation would rock but thats more of a longterm solution.,10562,409,248,0.0,neutral,0.391,positive
2021-01-07,  this will be hard to make as it isnt like any other vehicle,6107,192,475,-0.20833333333333334,negative,-0.3632,negative
2021-01-07, playing the long game,75729,2075,735,-0.225,negative,0.2023,positive
2021-01-07, i hope so. wings dont work on the moon at all and def not well on mars. also no runways.,6360,183,273,0.0,neutral,-0.0294,negative
2021-01-07, hamiltonians have 2v the potential of langrangians and a play!,5668,151,133,0.0,neutral,0.4003,positive
2021-01-07, well back to work ,119695,14426,2574,0.0,neutral,0.2732,positive
2021-01-07, ya dont say. reminds me of this timeless classic  ,18805,2408,359,0.16666666666666666,positive,0.0,neutral
2021-01-07, fast water with tiny rocks,15145,271,301,0.1,positive,0.0,neutral
2021-01-07, yes and then occams razor is actually third most likely,5040,151,158,0.16666666666666666,positive,0.4019,positive
2021-01-07,as seen from an external observer not the participants,63029,1784,1020,0.0,neutral,0.0,neutral
2021-01-07,the most entertaining outcome is the most likely,150720,10308,3278,0.375,positive,0.4927,positive
2021-01-07, dumb and dumber is a great movie tho,12373,296,354,0.21250000000000002,positive,-0.1779,negative
2021-01-07,this is called the domino effect ,354485,35497,4328,0.0,neutral,0.0,neutral
2021-01-05,         doesnt quite illustrate true size difference. starship payload volume  mass are gt1000 that of shuttle.,4602,206,221,0.35,positive,-0.3691,negative
2021-01-04,because of the large footprint it may seem flat but actually ranges up to 5 stories tall,55943,1010,1332,0.0630952380952381,positive,0.0,neutral
2021-01-04,snow falling on giga berlin ,143775,6554,3521,0.0,neutral,-0.1531,negative
2021-01-02, tesla is responsible for 23 of all the personal  professional pain in my life combined. but it was worth it.,12804,658,626,0.15000000000000002,positive,0.2144,positive
2021-01-02,so proud of the tesla team for achieving this major milestone! at the start of tesla i thought we had optimistically a 10 chance of surviving at all. ,106543,5972,4000,0.4390625,positive,0.8746,positive
2021-01-02, um we have giant fusion reactor in the sky that works with no maintenance,51202,2263,1845,0.0,neutral,-0.296,negative
2021-01-02, tesla full selfdriving will work at a safety level well above that of the average driver this year of that i am confident. cant speak for regulators though.,20120,890,655,0.175,positive,0.7964,positive
2021-01-01, dojo isnt needed but will make selfdriving better. it isnt enough to be safer than human drivers autopilot ultimately needs to be more than 10 times safer than human drivers.,3511,213,218,0.16666666666666666,positive,0.9052,positive
2020-12-31,"great interview with mathias döpfner
",49424,2988,1560,0.8,positive,0.6249,positive
2020-12-31, inspired by the ballet,6095,139,196,0.0,neutral,0.4939,positive
2020-12-31,  rocket motion is primarily vertical so you want the top open,4169,106,212,0.3,positive,0.3353,positive
2020-12-31, lets make the roaring 20s again!,45390,3342,2097,0.0,neutral,0.0,neutral
2020-12-30, might be a few lumps along the way,4561,87,187,-0.2,negative,0.0,neutral
2020-12-30,   production is hard prototypes are easy. building 1000 starships to create a selfsustaining city on mars is our mission.,7707,595,286,0.07083333333333333,positive,0.5574,positive
2020-12-30,   sn9 will press ch4 header tank with helium. longterm solution is under debate. not clear what is lightestsimplest.,4137,184,180,-0.05000000000000001,negative,0.0299,positive
2020-12-30,   legs would certainly work but best part is no part best step is no step,2904,146,132,0.7380952380952381,positive,0.8658,positive
2020-12-30,  saves mass  cost of legs  enables immediate repositioning of booster on to launch mount  ready to refly in under an hour,4825,213,177,0.2,positive,0.3612,positive
2020-12-30, were going to try to catch the super heavy booster with the launch tower arm using the grid fins to take the load,9554,741,879,0.06666666666666665,positive,0.5994,positive
2020-12-30,snakehead dog had my undivided attention until winderhead ostrich came gliding through all nonchalant ,96232,4112,2568,0.0,neutral,0.0,neutral
2020-12-30, seems odd that the opposition group is from bmws home state of baveria. thats very far from brandenburg where tesla is building the gigafactory.  and why would a group that claims to be proenvironment oppose a sustainable energy factory? arent there more important issues?,4404,295,271,0.21583333333333335,positive,-0.3332,negative
2020-12-30, this is very sensible. opposition from anywhere cannot mean no progress everywhere!,4130,149,126,-0.0953125,negative,-0.1867,negative
2020-12-30, are we sure this is real?,6912,245,546,0.35,positive,0.3182,positive
2020-12-30,"destiny destiny
no escaping 
that for me",148552,10695,5852,0.0,neutral,-0.25,negative
2020-12-29,all tesla cars delivered in the final three days of the year will get three months of the full selfdriving option for free. delivery  docs must be fully complete by midnight dec 31st.,69983,3299,3403,0.2125,positive,0.5106,positive
2020-12-29, and mark dankberg. this action is wack not dank!!,2112,80,77,0.15625,positive,0.0,neutral
2020-12-29,the last kingdom show is great,130948,5369,4593,0.4,positive,0.6249,positive
2020-12-29, absolutely. will be text  visualization but could add voice too.,1842,53,133,0.2,positive,0.0,neutral
2020-12-29, !! even cheese is made of cake !!,3072,60,109,0.0,neutral,0.0,neutral
2020-12-29, if they dont love us were in deep trouble!,5390,223,328,0.08333333333333333,positive,-0.7476,negative
2020-12-29,not everything is made of cake ,175578,11373,2674,0.0,neutral,0.0,neutral
2020-12-29,such a weird game when you think about it ,336621,30964,3744,-0.3,negative,-0.1779,negative
2020-12-29,this is not cgi ,61186,10054,4354,0.0,neutral,0.0,neutral
2020-12-29, we need a ui overhaul,8688,156,482,0.0,neutral,0.0,neutral
2020-12-29,   no these are just incremental improvements to the production codebase. fsd build is a fundamental rewrite not just in the car but also our video traininglabeling software.,1345,60,61,0.0,neutral,0.0129,positive
2020-12-29, starlink poses a hazard to viasats profits more like it. stop the sneaky moves charlie ergen!,18077,864,562,0.625,positive,0.3861,positive
2020-12-28,entertainment will be critical when cars drive themselves,52288,2354,2704,0.0,neutral,0.128,positive
2020-12-28, just meeting with larry ellison to seek some advice. back working on tesla end of quarter tomorrow.,8282,295,568,0.0,neutral,0.0,neutral
2020-12-28,what should tesla do with incar gaming in an autonomous world?,32088,812,6441,0.4,positive,0.0,neutral
2020-12-28, taste of the future,6679,176,316,0.0,neutral,0.0,neutral
2020-12-27,try playing polytopia in your tesla! great game. multiplayer online version coming soon.,139934,3781,4977,0.2,positive,0.7345,positive
2020-12-27, focus on making products  services people truly love so that the total economic pie is bigger instead of engaging in zerosumnegativesum corporate power struggles. this is the good future.,44252,4740,1091,0.225,positive,0.872,positive
2020-12-27,    roughly 95 of parts in tesla roadster were unique  not in any other product. unfortunately since we started out with the dumb in retrospect goal of simply adapting lotus elise to electric we ended up with a 10 too small sports car that seems kinda like a lotus.,1945,68,102,-0.1392857142857143,negative,-0.5413,negative
2020-12-27,  ok service might be able to do this. will check.,2906,114,235,0.5,positive,0.296,positive
2020-12-27,  you mean install the external speaker on earlier cars that dont have it?,1446,37,107,-0.10416666666666667,negative,0.0,neutral
2020-12-27,  no but definitely this year,1446,90,91,0.0,neutral,0.4497,positive
2020-12-27, liz has always done great interviews,11851,196,217,0.8,positive,0.6249,positive
2020-12-27,  falcon was 25 of successful orbital launches in 2020 but maybe a majority of payload to orbit. anyone done the math?,4431,141,123,0.75,positive,0.34,positive
2020-12-27, vaccines are just the start. its also capable in theory of curing almost anything. turns medicine into a software  simulation problem.,4384,395,252,0.2,positive,-0.0258,negative
2020-12-26,     we will offer multiple display options,1560,68,85,0.0,neutral,0.0,neutral
2020-12-26,   a few more revisions needed. probably beta 10 or 11.,1575,63,79,0.15,positive,0.0,neutral
2020-12-26,   there are subtle important differences between us  canada traffic rules but fsd beta will be extended to canada very soon,1879,102,231,0.0888888888888889,positive,0.1027,positive
2020-12-26, we need a match other traffic speed setting,12670,287,500,-0.125,negative,0.0,neutral
2020-12-25,  its a step in that direction,4627,74,132,0.0,neutral,0.0,neutral
2020-12-25, its one  or 12  if you dont have a car with pedestrian speaker. we couldnt get everything done in time but more stuff coming.,1948,100,198,0.5,positive,0.0,neutral
2020-12-25, the writing on cobra kai is sick,5497,137,114,-0.7142857142857143,negative,-0.5106,negative
2020-12-25, haha i will save you the nightmare of seeing me in those shorts,7517,131,210,0.2,positive,0.7351,positive
2020-12-25, you can upload custom musicsounds,13795,273,216,0.0,neutral,0.0,neutral
2020-12-25, unfortunately pedestrian speaker is needed otherwise no external sound generator except actual horn,3954,61,213,-0.024999999999999994,negative,-0.5574,negative
2020-12-25,change your horn sound to    or holiday jingles with latest tesla software update!,178059,6437,5033,0.5125,positive,0.4574,positive
2020-12-25,merry christmas  happy holidays!  ,224641,12183,7076,1.0,positive,0.8777,positive
2020-12-25,  it will most likely make sense for starlink to go public once the revenue growth is reasonably predictable,3528,200,257,0.075,positive,0.3818,positive
2020-12-25, engineering design  general company operations absorb vast majority of my mind  are the fundamental limitation on doing more.  capital allocation is important but low cpu load. tesla public company duties are a much bigger factor but going private is impossible now sigh.,2430,148,209,0.03148148148148149,positive,-0.4019,negative
2020-12-24,12 story rocket turns off its engines  does a controlled fall ,98001,8109,3255,0.0,neutral,0.0,neutral
2020-12-24, yup were just ironing out a few bugs,7791,161,281,-0.2,negative,0.0,neutral
2020-12-24,to tesla owners taking delivery in the final days of year your support is super appreciated!!,142444,3221,3324,0.21527777777777776,positive,0.8881,positive
2020-12-23,  frictionless ai. what could possibly go wrong?,2705,126,193,-0.5,negative,-0.4767,negative
